{
  "id": "core/beast-fight",
  "version": 1,
  "purpose": "encounter.beast.fight",
  "label": "Fighting the beasts",
  "selection": { "mode": "weighted" },
  "entries": [
    {
      "id": "victory",
      "weight": 6,
      "result": {
        "text": "The beasts fall dead at your feet.",
        "effects": [
          {
            "type": "add_fact",
            "category": "remains",
            "tags": ["beast", "fresh"],
            "data": { "count": 3, "origin": "wild_beasts" },
            "persistence": { "mode": "evolves", "procedure": "core/remains-evolution@1" }
          },
          { "type": "log", "text": "The carcasses will draw scavengers before long." }
        ]
      }
    },
    {
      "id": "mauled",
      "weight": 3,
      "result": {
        "text": "You drive them off, bleeding from a dozen bites.",
        "effects": [{ "type": "log", "text": "You need rest, but the road will not wait." }]
      }
    },
    {
      "id": "they-flee",
      "weight": 2,
      "result": { "text": "Your stand breaks the pack's nerve; they scatter!" }
    }
  ]
}
